Availability,Price,Beds,Baths,Sqft,Address,Community,URL
Move-in ready,"$614,327",4.0,3.0,2419.0,"9001 Antelope Pass Drive, Reno, NV",The Carnelian in Peavine Trails at Stonefield,https://www.lennar.com/new-homes/nevada/reno/reno/peavine-trails-at-stonefield/the-carnelian/10255510424
Move-in ready,"$524,950",5.0,3.0,2757.0,"410 Sabino Canyon Road, Dayton, NV",The Conestoga in Copper Canyon II,https://www.lennar.com/new-homes/nevada/reno/dayton/copper-canyon-ii/the-conestoga/10225510330
Move-in ready,"$509,950",3.0,2.0,1721.0,"6397 Bucking Horse Drive, Sparks, NV",The Pinon in Homestead at Kiley Ranch,https://www.lennar.com/new-homes/nevada/reno/sparks/homestead-at-kiley-ranch/the-pinon/10222510011
Move-in ready,"$1,280,136",4.0,3.0,3336.0,"10381 Palladium Mine Drive, Reno, NV",The Palatino in Viewmont at Palisades,https://www.lennar.com/new-homes/nevada/reno/reno/viewmont-at-palisades/the-palatino/10297510173
Move-in ready,"$534,950",4.0,2.0,1953.0,"137 Pilot Peak Drive, Carson City, NV",The Cottonwood in Mills Meadow,https://www.lennar.com/new-homes/nevada/reno/carson-city/mills-meadow/the-cottonwood/10247510159
Move-in ready,"$710,994",4.0,3.0,2547.0,"300 Littondale Drive, Sparks, NV",The Shire in Silver Ridge II,https://www.lennar.com/new-homes/nevada/reno/sparks/silver-ridge-ii/the-shire/10220510493
Move-in ready,"$999,500",4.0,3.0,2859.0,"2840 Trail Rider Drive, Reno, NV",The Portofino in Golden Hills,https://www.lennar.com/new-homes/nevada/reno/reno/golden-hills/the-portofino/1189510253
Move-in ready,"$539,950",4.0,3.0,2400.0,"515 Echo Canyon Road, Dayton, NV",The Ponderosa in Copper Canyon II,https://www.lennar.com/new-homes/nevada/reno/dayton/copper-canyon-ii/the-ponderosa/10225510355
Move-in ready,"$449,950",3.0,2.0,2200.0,"500 Echo Canyon Road, Dayton, NV",The Comstock in Copper Canyon II,https://www.lennar.com/new-homes/nevada/reno/dayton/copper-canyon-ii/the-comstock/10225510386
Move-in ready,"$509,950",4.0,3.0,2547.0,"504 Echo Canyon Road, Dayton, NV",The Shire in Copper Canyon II,https://www.lennar.com/new-homes/nevada/reno/dayton/copper-canyon-ii/the-shire/10225510385
Move-in ready,"$499,950",4.0,3.0,2400.0,"508 Echo Canyon Road, Dayton, NV",The Ponderosa in Copper Canyon II,https://www.lennar.com/new-homes/nevada/reno/dayton/copper-canyon-ii/the-ponderosa/10225510384
Move-in ready,"$519,950",4.0,3.0,2203.0,"8918 Coyote Bluff Drive, Reno, NV",The Emery in Peavine Trails at Stonefield,https://www.lennar.com/new-homes/nevada/reno/reno/peavine-trails-at-stonefield/the-emery/10255510114
Move-in ready,"$599,951",4.0,3.0,2714.0,"2063 Neuer Drive, Sparks, NV",The Babette in Pele at Pioneer Meadows,https://www.lennar.com/new-homes/nevada/reno/sparks/pele-at-pioneer-meadows/the-babette/10237510117
Under construction,"$593,476",4.0,3.0,1885.0,"2053 Neuer Drive, Sparks, NV",The Korel in Pele at Pioneer Meadows,https://www.lennar.com/new-homes/nevada/reno/sparks/pele-at-pioneer-meadows/the-korel/10237510118
Under construction,"$614,923",4.0,3.0,2547.0,"519 Echo Canyon Road, Dayton, NV",The Shire in Copper Canyon II,https://www.lennar.com/new-homes/nevada/reno/dayton/copper-canyon-ii/the-shire/10225510354
Under construction,"$574,950",4.0,2.5,2300.0,"15 Pilot Peak Court, Carson City, NV",The Abetta in Mills Meadow,https://www.lennar.com/new-homes/nevada/reno/carson-city/mills-meadow/the-abetta/10247510154
Under construction,"$459,950",3.0,2.5,1614.0,"623 Coyote Bluff Court, Reno, NV",The Pietra in Arvada at Stonefield,https://www.lennar.com/new-homes/nevada/reno/reno/arvada-at-stonefield/the-pietra/10254510160
Under construction,"$556,601",4.0,3.0,2100.0,"1959 Boundary Peak Street, Carson City, NV",The Highland in Mills Meadow,https://www.lennar.com/new-homes/nevada/reno/carson-city/mills-meadow/the-highland/10247510146
Under construction,"$699,950",4.0,3.5,3055.0,"6358 Red Stable Road, Sparks, NV",The Kensington in Ironwood at Kiley Ranch,https://www.lennar.com/new-homes/nevada/reno/sparks/ironwood-at-kiley-ranch/the-kensington/10223510115
Under construction,"$609,950",4.0,3.0,2400.0,"2100 Cheetah Creek Drive, Sparks, NV",The Ponderosa in Silver Ridge II,https://www.lennar.com/new-homes/nevada/reno/sparks/silver-ridge-ii/the-ponderosa/10220510498
Under construction,"$524,950",3.0,2.5,2021.0,"8965 Wolf River Drive, Reno, NV",The Onyx in Peavine Trails at Stonefield,https://www.lennar.com/new-homes/nevada/reno/reno/peavine-trails-at-stonefield/the-onyx/10255510101
Under construction,"$605,241",4.0,2.5,2175.0,"1120 Dapple Drive, Minden, NV",The Sandstone in Weser Creek at Heybourne Meadows,https://www.lennar.com/new-homes/nevada/reno/minden/weser-creek-at-heybourne-meadows/the-sandstone/10245510415
Under construction,"$549,950",3.0,2.0,1721.0,"1123 Dapple Drive, Minden, NV",The Pinon in Weser Creek at Heybourne Meadows,https://www.lennar.com/new-homes/nevada/reno/minden/weser-creek-at-heybourne-meadows/the-pinon/10245510586
Under construction,"$459,950",3.0,2.5,1823.0,"619 Coyote Bluff Court, Reno, NV",The Peridot in Arvada at Stonefield,https://www.lennar.com/new-homes/nevada/reno/reno/arvada-at-stonefield/the-peridot/10254510161
Under construction,"$619,950",3.0,2.0,2200.0,"2118 Cheetah Creek Drive, Sparks, NV",The Comstock in Silver Ridge II,https://www.lennar.com/new-homes/nevada/reno/sparks/silver-ridge-ii/the-comstock/10220514101
Under construction,"$499,950",3.0,2.5,1945.0,"615 Coyote Bluff Court, Reno, NV",The Garnet in Arvada at Stonefield,https://www.lennar.com/new-homes/nevada/reno/reno/arvada-at-stonefield/the-garnet/10254510162
Under construction,"$499,950",3.0,2.0,1528.0,"2212 Heights View Lane, Sparks, NV",The Cheyenne in Sendero at Pioneer Meadows,https://www.lennar.com/new-homes/nevada/reno/sparks/sendero-at-pioneer-meadows/the-cheyenne/10230510561
Under construction,"$539,950",4.0,2.5,2367.0,"2048 Neuer Drive, Sparks, NV",The Bolero in Pele at Pioneer Meadows,https://www.lennar.com/new-homes/nevada/reno/sparks/pele-at-pioneer-meadows/the-bolero/10237510110
Under construction,"$599,950",5.0,3.0,2441.0,"2232 Heights View Lane, Sparks, NV",The Aurora in Sendero at Pioneer Meadows,https://www.lennar.com/new-homes/nevada/reno/sparks/sendero-at-pioneer-meadows/the-aurora/10230510559
Under construction,"$609,950",4.0,2.5,2300.0,"6388 Red Stable Road, Sparks, NV",The Abetta in Ironwood at Kiley Ranch,https://www.lennar.com/new-homes/nevada/reno/sparks/ironwood-at-kiley-ranch/the-abetta/10223510112
Under construction,"$519,950",3.0,2.5,2090.0,"2028 Neuer Drive, Sparks, NV",The Danver in Pele at Pioneer Meadows,https://www.lennar.com/new-homes/nevada/reno/sparks/pele-at-pioneer-meadows/the-danver/10237510108
Under construction,"$559,950",4.0,2.0,1953.0,"7106 Owl View Drive, Sparks, NV",The Cottonwood in Sendero at Pioneer Meadows,https://www.lennar.com/new-homes/nevada/reno/sparks/sendero-at-pioneer-meadows/the-cottonwood/10230510540
Under construction,"$524,950",3.0,2.0,1621.0,"1121 Dapple Drive, Minden, NV",The Tule in Weser Creek at Heybourne Meadows,https://www.lennar.com/new-homes/nevada/reno/minden/weser-creek-at-heybourne-meadows/the-tule/10245510587
Under construction,"$549,950",4.0,2.5,2247.0,"2267 Heights View Lane, Sparks, NV",The Silverado in Sendero at Pioneer Meadows,https://www.lennar.com/new-homes/nevada/reno/sparks/sendero-at-pioneer-meadows/the-silverado/10230510505
Under construction,"$574,950",4.0,2.5,2175.0,"6452 Bucking Horse Court, Sparks, NV",The Sandstone in Homestead at Kiley Ranch,https://www.lennar.com/new-homes/nevada/reno/sparks/homestead-at-kiley-ranch/the-sandstone/10222510017
Under construction,"$589,406",4.0,3.0,2419.0,"8976 Wolf River Drive, Reno, NV",The Carnelian in Peavine Trails at Stonefield,https://www.lennar.com/new-homes/nevada/reno/reno/peavine-trails-at-stonefield/the-carnelian/10255510055
Under construction,"$684,950",5.0,3.0,2757.0,"573 Fox Branch Drive, Sparks, NV",The Conestoga in Silver Ridge II,https://www.lennar.com/new-homes/nevada/reno/sparks/silver-ridge-ii/the-conestoga/10220510448
Under construction,"$654,950",4.0,3.5,3055.0,"1927 Boundary Peak Street, Carson City, NV",The Kensington in Mills Meadow,https://www.lennar.com/new-homes/nevada/reno/carson-city/mills-meadow/the-kensington/10247510144
Under construction,"$549,950",3.0,2.0,1950.0,"6381 June Bug Drive, Sparks, NV",The Juniper in Homestead at Kiley Ranch,https://www.lennar.com/new-homes/nevada/reno/sparks/homestead-at-kiley-ranch/the-juniper/10222510026
Under construction,"$549,950",3.0,2.0,1950.0,"1116 Dapple Drive, Minden, NV",The Juniper in Weser Creek at Heybourne Meadows,https://www.lennar.com/new-homes/nevada/reno/minden/weser-creek-at-heybourne-meadows/the-juniper/10245510417
Under construction,"$659,950",4.0,3.5,2675.0,"7101 Lemur Landing Way, Sparks, NV",The Santa Maria in Sendero at Pioneer Meadows,https://www.lennar.com/new-homes/nevada/reno/sparks/sendero-at-pioneer-meadows/the-santa-maria/10230510539
Future release,,,,,,,https://www.lennar.com/new-homes/nevada/reno/sparks/homestead-at-kiley-ranch/the-tule
Future release,,,,,,,https://www.lennar.com/new-homes/nevada/reno/sparks/ironwood-at-kiley-ranch/the-lucchese
Future release,,,,,,,https://www.lennar.com/new-homes/nevada/reno/reno/peavine-trails-at-stonefield/the-jasper
Future release,,,,,,,https://www.lennar.com/new-homes/nevada/reno/reno/viewmont-at-palisades/the-portofino
Future release,,,,,,,https://www.lennar.com/new-homes/nevada/reno/reno/viewmont-at-palisades/the-rapallo
Future release,,,,,,,https://www.lennar.com/new-homes/nevada/reno/reno/viewmont-at-palisades/the-versanti
